{
  "$schema": "https://json-schema.org/draft/2020-12/schema",
  "title": "scenario_vulnerability_facts.normalized",
  "type": "object",
  "required": [
    "schema_version",
    "created_from",
    "normalization_policy",
    "scenarios"
  ],
  "properties": {
    "schema_version": {
      "type": "string"
    },
    "created_from": {
      "type": "string"
    },
    "normalization_policy": {
      "type": "object"
    },
    "scenarios": {
      "type": "array",
      "items": {
        "type": "object",
        "required": [
          "scenario_id",
          "original_scenario_id",
          "scenario_type",
          "cve_ids",
          "product_hint",
          "language_or_stack",
          "source_status",
          "safe_annotation_summary",
          "official_fact_summary",
          "scenario_doc_summary",
          "confirmed_weakness",
          "confirmed_impact",
          "affected_component",
          "allowed_terms",
          "blocked_or_risky_terms",
          "disallowed_if_not_observed",
          "quality_flags",
          "annotation_use_policy",
          "sources"
        ]
      }
    }
  }
}
