{"schema_version":"scenario_vulnerability_facts.normalized.v0.1","created_from":"scenario_vulnerability_facts.json","normalization_policy":{"network_access":false,"raw_seed_preserved":true,"prompt_safe_field":"safe_annotation_summary","required_warning":"This auxiliary fact must not be used without primary log evidence."},"scenarios":[{"scenario_id":"juice-shop","original_scenario_id":"juice-shop","scenario_type":"non_cve_training_app","cve_ids":[],"product_hint":"OWASP Juice Shop","language_or_stack":"Node.js / Express / Angular","source_status":{"has_nvd":false,"has_cve_program":false,"has_vulhub":false,"has_owasp":true,"has_local_context":true,"failed_sources":[{"source_type":"OWASP","url":"https://raw.githubusercontent.com/OWASP/www-project-juice-shop/main/index.md","status":"failed","error":"HTTP Error 404: Not Found"}]},"safe_annotation_summary":"OWASP Juice Shop is a non-CVE training application context. It may be used only as auxiliary background for the lab application and must not be used for stage assignment. This auxiliary fact must not be used without primary log evidence.","official_fact_summary":"","scenario_doc_summary":"Local or OWASP context files are present for juice-shop.","confirmed_weakness":[],"confirmed_impact":[],"affected_component":"OWASP Juice Shop","allowed_terms":[],"blocked_or_risky_terms":[],"disallowed_if_not_observed":["payload executed","shell obtained","data exfiltration","privilege escalation","persistence installed"],"quality_flags":{"needs_manual_review":true,"non_cve_context_only":true,"summary_was_sanitized":false,"official_summary_empty":true,"scenario_doc_missing":false,"contains_risky_mechanism_terms":false},"annotation_use_policy":{"role":"auxiliary_vulnerability_context","can_support":["checking whether a vulnerability mechanism term is factually valid","checking whether observed behavior is consistent with public vulnerability facts"],"cannot_support":["stage assignment without primary evidence","inventing unseen payloads","inventing unseen attack results","adding CVE facts to model_input"]},"sources":[{"source_type":"OWASP","url":"https://raw.githubusercontent.com/juice-shop/juice-shop/master/README.md","local_cache_path":"raw_sources/owasp/e6874050ba0c_README.md","retrieved_at":"2026-04-25T14:20:42+00:00","status":"ok","error":""},{"source_type":"OWASP","url":"https://raw.githubusercontent.com/juice-shop/juice-shop/master/REFERENCES.md","local_cache_path":"raw_sources/owasp/c367f7aa6f50_REFERENCES.md","retrieved_at":"2026-04-25T14:20:43+00:00","status":"ok","error":""},{"source_type":"OWASP","url":"https://raw.githubusercontent.com/OWASP/www-project-juice-shop/main/index.md","local_cache_path":"","retrieved_at":"2026-04-25T14:20:44+00:00","status":"failed","error":"HTTP Error 404: Not Found"},{"source_type":"OWASP","url":"local:example/juice-shop/challenges.yml","local_cache_path":"raw_sources/owasp/challenges.yml","retrieved_at":"2026-04-25T14:20:53+00:00","status":"ok","error":""},{"source_type":"LOCAL_SCENARIO_CONTEXT","url":"local:example/juice-shop/scene.yml","local_cache_path":"raw_sources/local/juice-shop/scene.yml","retrieved_at":"2026-04-25T14:20:53+00:00","status":"ok","error":""},{"source_type":"LOCAL_SCENARIO_CONTEXT","url":"local:example/juice-shop/README.md","local_cache_path":"raw_sources/local/juice-shop/README.md","retrieved_at":"2026-04-25T14:20:53+00:00","status":"ok","error":""},{"source_type":"LOCAL_SCENARIO_CONTEXT","url":"local:example/juice-shop/docker-compose.yml","local_cache_path":"raw_sources/local/juice-shop/docker-compose.yml","retrieved_at":"2026-04-25T14:20:53+00:00","status":"ok","error":""},{"source_type":"LOCAL_SCENARIO_CONTEXT","url":"local:example/juice-shop/Dockerfile","local_cache_path":"raw_sources/local/juice-shop/Dockerfile","retrieved_at":"2026-04-25T14:20:53+00:00","status":"ok","error":""}]},{"scenario_id":"vulhub/gitlist/CVE-2018-1000533","original_scenario_id":"vulhub/gitlist/CVE-2018-1000533","scenario_type":"cve","cve_ids":["CVE-2018-1000533"],"product_hint":"GitList","language_or_stack":"PHP","source_status":{"has_nvd":true,"has_cve_program":true,"has_vulhub":true,"has_owasp":false,"has_local_context":false,"failed_sources":[]},"safe_annotation_summary":"GitList is associated with public vulnerability metadata. This auxiliary fact must not be used without primary log evidence.","official_fact_summary":"klaussilveira GitList version <= 0.6 contains a Passing incorrectly sanitized input to system function vulnerability in `searchTree` function that can result in Execute any code as PHP user. This attack appear to be exploitable via Send POST request using search form. This vulnerability appears to have been fixed in 0.7 after commit 87b8c26b023c3fc37f0796b14bb13710f397b322.","scenario_doc_summary":"Vulhub scenario documentation is present for vulhub/gitlist/CVE-2018-1000533.","confirmed_weakness":[{"term":"CWE-20","source_refs":["NVD"],"confidence":"official"}],"confirmed_impact":[{"term":"CVSS 3.1 baseSeverity=CRITICAL (score=9.8)","source_refs":["NVD"],"confidence":"official"},{"term":"attackVector=NETWORK","source_refs":["NVD"],"confidence":"official"}],"affected_component":"cpe:2.3:a:gitlist:gitlist:*:*:*:*:*:*:*:*","allowed_terms":[],"blocked_or_risky_terms":["exploit","execute"],"disallowed_if_not_observed":["payload executed","shell obtained","data exfiltration","privilege escalation","persistence installed"],"quality_flags":{"needs_manual_review":false,"non_cve_context_only":false,"summary_was_sanitized":true,"official_summary_empty":false,"scenario_doc_missing":false,"contains_risky_mechanism_terms":true},"annotation_use_policy":{"role":"auxiliary_vulnerability_context","can_support":["checking whether a vulnerability mechanism term is factually valid","checking whether observed behavior is consistent with public vulnerability facts"],"cannot_support":["stage assignment without primary evidence","inventing unseen payloads","inventing unseen attack results","adding CVE facts to model_input"]},"sources":[{"source_type":"NVD","url":"https://services.nvd.nist.gov/rest/json/cves/2.0?cveId=CVE-2018-1000533","local_cache_path":"raw_sources/nvd/CVE-2018-1000533.json","retrieved_at":"2026-04-25T14:20:53+00:00","status":"ok","error":""},{"source_type":"CVE_PROGRAM","url":"https://cveawg.mitre.org/api/cve/CVE-2018-1000533","local_cache_path":"raw_sources/cve_program/CVE-2018-1000533.json","retrieved_at":"2026-04-25T14:21:01+00:00","status":"ok","error":""},{"source_type":"VULHUB","url":"https://raw.githubusercontent.com/vulhub/vulhub/master/gitlist/CVE-2018-1000533/README.md","local_cache_path":"raw_sources/vulhub/gitlist_CVE-2018-1000533__README.md","retrieved_at":"2026-04-25T14:21:03+00:00","status":"ok","error":""},{"source_type":"VULHUB","url":"https://raw.githubusercontent.com/vulhub/vulhub/master/gitlist/CVE-2018-1000533/README.zh-cn.md","local_cache_path":"raw_sources/vulhub/gitlist_CVE-2018-1000533__README.zh-cn.md","retrieved_at":"2026-04-25T14:21:04+00:00","status":"ok","error":""},{"source_type":"VULHUB","url":"https://raw.githubusercontent.com/vulhub/vulhub/master/gitlist/CVE-2018-1000533/docker-compose.yml","local_cache_path":"raw_sources/vulhub/gitlist_CVE-2018-1000533__docker-compose.yml","retrieved_at":"2026-04-25T14:21:06+00:00","status":"ok","error":""}]},{"scenario_id":"vulhub/geoserver/CVE-2023-25157","original_scenario_id":"vulhub/geoserver/CVE-2023-25157","scenario_type":"cve","cve_ids":["CVE-2023-25157"],"product_hint":"GeoServer","language_or_stack":"Java","source_status":{"has_nvd":true,"has_cve_program":true,"has_vulhub":true,"has_owasp":false,"has_local_context":false,"failed_sources":[]},"safe_annotation_summary":"GeoServer is associated with SQL-injection weakness metadata. This auxiliary fact must not be used without primary log evidence.","official_fact_summary":"GeoServer is an open source software server written in Java that allows users to share and edit geospatial data. GeoServer includes support for the OGC Filter expression language and the OGC Common Query Language (CQL) as part of the Web Feature Service (WFS) and Web Map Service (WMS) protocols.  CQL is also supported through the Web Coverage Service (WCS) protocol for ImageMosaic coverages. Users are advised to upgrade to either version 2.21.4, or version 2.22.2 to resolve this issue. Users una","scenario_doc_summary":"Vulhub scenario documentation is present for vulhub/geoserver/CVE-2023-25157.","confirmed_weakness":[{"term":"CWE-89","source_refs":["NVD"],"confidence":"official"}],"confirmed_impact":[{"term":"CVSS 3.1 baseSeverity=CRITICAL (score=9.8)","source_refs":["NVD"],"confidence":"official"},{"term":"attackVector=NETWORK","source_refs":["NVD"],"confidence":"official"}],"affected_component":"cpe:2.3:a:osgeo:geoserver:*:*:*:*:*:*:*:*, cpe:2.3:a:osgeo:geoserver:*:*:*:*:*:*:*:*, cpe:2.3:a:osgeo:geoserver:*:*:*:*:*:*:*:*","allowed_terms":[],"blocked_or_risky_terms":["RCE"],"disallowed_if_not_observed":["payload executed","shell obtained","data exfiltration","privilege escalation","persistence installed"],"quality_flags":{"needs_manual_review":false,"non_cve_context_only":false,"summary_was_sanitized":true,"official_summary_empty":false,"scenario_doc_missing":false,"contains_risky_mechanism_terms":true},"annotation_use_policy":{"role":"auxiliary_vulnerability_context","can_support":["checking whether a vulnerability mechanism term is factually valid","checking whether observed behavior is consistent with public vulnerability facts"],"cannot_support":["stage assignment without primary evidence","inventing unseen payloads","inventing unseen attack results","adding CVE facts to model_input"]},"sources":[{"source_type":"NVD","url":"https://services.nvd.nist.gov/rest/json/cves/2.0?cveId=CVE-2023-25157","local_cache_path":"raw_sources/nvd/CVE-2023-25157.json","retrieved_at":"2026-04-25T14:21:07+00:00","status":"ok","error":""},{"source_type":"CVE_PROGRAM","url":"https://cveawg.mitre.org/api/cve/CVE-2023-25157","local_cache_path"